{
  "name": "PR & Commit Message Maker",
  "slug": "pr-commit-maker",
  "version": "1.0.0",
  "status": "stable",
  "category": "collab",
  "summary": "git diff 를 받아 Conventional Commit 메시지, PR 본문, 브랜치명을 규칙에 맞게 생성합니다.",
  "variables": [
    {
      "name": "GIT_DIFF",
      "required": true,
      "description": "git diff 출력 또는 변경 내용 요약",
      "example": "diff --git a/scripts/lint-skills.mjs ... + 변수 정합성 검사 추가"
    },
    {
      "name": "CHANGE_TYPE",
      "required": false,
      "description": "커밋 타입 강제 지정 (미입력 시 diff 로 자동 추론)",
      "example": "feat"
    },
    {
      "name": "TEST_RESULT",
      "required": false,
      "description": "테스트/검증 결과 (있으면 PR 검증 섹션에 반영)",
      "example": "npm run lint:skills 통과 (3개 스킬, 경고 0)"
    },
    {
      "name": "ISSUE_REF",
      "required": false,
      "description": "연결할 이슈 번호",
      "example": "#12"
    },
    {
      "name": "COMMIT_LANG",
      "required": false,
      "description": "커밋/PR 제목 언어 (기본 en)",
      "example": "en"
    },
    {
      "name": "PR_BODY_LANG",
      "required": false,
      "description": "PR 본문 언어 (기본 ko)",
      "example": "ko"
    }
  ],
  "i18n": ["en", "ko"],
  "compatibility": {
    "claude-opus-4": "excellent",
    "gpt-4o": "untested",
    "gemini-1-5-pro": "untested"
  },
  "risk": "read-only",
  "tags": ["git", "commit", "pull-request", "conventional-commits", "collab"],
  "quality": {
    "last_eval": "2026-06-22"
  }
}
