{
  "name": "GitHub Workflow",
  "slug": "github-workflow",
  "version": "1.0.0",
  "status": "stable",
  "category": "collab",
  "summary": "main 동기화부터 브랜치·커밋·푸시·PR·머지 게이트까지 Git/GitHub 라이프사이클 전체를 단계별로 진행합니다.",
  "variables": [
    {
      "name": "CHANGE_DESCRIPTION",
      "required": true,
      "description": "이번에 작업할 내용 (브랜치명·커밋 subject 추론에 사용)",
      "example": "회의실 예약 생성 API 추가"
    },
    {
      "name": "BASE_BRANCH",
      "required": false,
      "description": "기준 브랜치 (기본 main)",
      "example": "main"
    },
    {
      "name": "CHANGE_TYPE",
      "required": false,
      "description": "커밋/브랜치 타입 강제 (미입력 시 작업 내용으로 추론)",
      "example": "feat"
    },
    {
      "name": "ISSUE_REF",
      "required": false,
      "description": "연결할 이슈 번호",
      "example": "#12"
    },
    {
      "name": "MERGE_METHOD",
      "required": false,
      "description": "머지 방식 (기본 squash)",
      "example": "squash"
    },
    {
      "name": "TEAM_RULES",
      "required": false,
      "description": "팀 머지 규칙 (브랜치 보호/리뷰 필수/머지 방식 등). 비어 있으면 머지 게이트에서 질문",
      "example": "리뷰 1명 승인 필수, squash, 머지 후 브랜치 삭제"
    }
  ],
  "i18n": ["en", "ko"],
  "compatibility": {
    "claude-opus-4": "excellent",
    "gpt-4o": "untested",
    "gemini-1-5-pro": "untested"
  },
  "risk": "network",
  "tags": ["git", "github", "workflow", "pull-request", "branch", "merge", "collab"],
  "quality": {
    "last_eval": "2026-06-23"
  }
}
